speaker,start,end,text
Unknown Interviewer,00;57;12;05,00;57;21;02,"Our lives are not far from. You're not going to get any popcorn. Everyone, you get their clothes on."
Bonnie Nellsch,00;57;21;09,00;57;25;07,Aren't you anxious to have kids? Now that you've seen on the left.
Unknown Interviewer,00;57;25;10,00;57;35;24,"Of that, they don't bother me at work. But you have faith in front of her and her children. When they said something, they repeated it. It's been reported."
Bonnie Nellsch,00;57;35;26,00;57;37;00,"That. Oh, yeah."
Unknown Interviewer,00;57;37;04,00;57;44;03,"That, murder. I can only ever recall ever babysitting and having to look at our memories like that."
Bonnie Nellsch,00;57;44;05,00;57;52;18,"Yeah. Of course, it's, real easy to be around them. And then you can be part and be by yourself again for my."
Unknown Interviewer,00;57;52;25,00;58;01;00,"And for me, like, 5:00 for her, for her. We have to marry that one to your decision."
Bonnie Nellsch,00;58;01;03,00;58;02;13,"Yeah, we'll think about."
Unknown Interviewer,00;58;02;13,00;58;03;05,It a lot.
Bonnie Nellsch,00;58;03;07,00;58;05;07,A long time freedom. Because once you've.
Unknown Interviewer,00;58;05;07,00;58;13;02,Got that all right for different. Yeah. You're okay. We have a lot more to go back.
Bonnie Nellsch,00;58;13;21,00;58;17;07,"yeah, I think I just have to do."
Unknown Interviewer,00;58;17;09,00;58;21;20,Where did you learn about childbirth and childbirth?
Bonnie Nellsch,00;58;21;22,00;58;22;11,How great.
Unknown Interviewer,00;58;22;29,00;58;36;18,"moment on the spot. Pretty spot first for me. Yeah, right. but I don't think we to."
Unknown Interviewer,00;58;36;20,00;58;43;14,There was really no sex education to speak of at school. we were in school for that. In your home life.
Bonnie Nellsch,00;58;43;15,00;58;45;17,For us. There wasn't really.
Unknown Interviewer,00;58;45;20,00;58;54;27,"There. No, because my mom, my our mother was, brought up so strict that it wasn't talked about at all."
Bonnie Nellsch,00;58;55;01,00;59;04;04,"It was a definite no in their home. And so she brought us up. Pretty much no one had to come. Just get in there and play. Christy, we're not going for."
Unknown Interviewer,00;59;04;04,00;59;08;17,Quite a while. I'll go for a close up play in the bedroom.
Bonnie Nellsch,00;59;08;19,00;59;17;28,"You two can get in there. Well, I love your mom. Well, you can just wait a little bit. I know, now."
Unknown Interviewer,00;59;18;01,00;59;19;18,When I learned about sex.
Bonnie Nellsch,00;59;19;18,00;59;25;02,Was out on the farm watching the animals.
Unknown Interviewer,00;59;25;28,00;59;33;17,"And, to try to take it a course in health care when I talk,"
Bonnie Nellsch,00;59;33;19,00;59;38;03,"I think about kids to, like, childcare to babysitting."
Unknown Interviewer,00;59;38;18,00;59;39;03,you learn a.
Bonnie Nellsch,00;59;39;03,00;59;44;20,"Lot about kids by babysitting. And we babysat,"
Unknown Interviewer,00;59;44;22,01;00;03;12,"Oh, so it comes to our children, ya know, when you're pregnant with magic rock and rock? no, I do not have any questions at all. And I was pregnant. Are you? I wasn't concerned about, you know, and you're."
Unknown Interviewer,01;00;03;15,01;00;11;00,"I don't know, I remember you were carrying both kids. How are you that impressive?"
Bonnie Nellsch,01;00;11;03,01;00;14;01,Your until they were there. I got a minute.
Unknown Interviewer,01;00;14;01,01;00;24;00,"I had have one. I have one right. So, I couldn't care less when I'm hearing."
Bonnie Nellsch,01;00;24;02,01;00;27;20,Now I was different. I was curious and nervous at all throughout the pregnancy.
Unknown Interviewer,01;00;27;24,01;00;40;24,"I wasn't, that I was quite cold. I just wasn't at all kept from the idea until I had them."
Unknown Interviewer,01;00;40;26,01;00;44;29,Would you ask questions this week for know?
Bonnie Nellsch,01;00;44;29,01;00;47;12,I have some questions. You know.
Unknown Interviewer,01;00;47;15,01;00;54;10,"With very, very long. With questions. Oh, yeah. I."
Unknown Interviewer,01;00;54;12,01;01;10;26,"Where are your children? Have never found her. Not. Oh, I had neither one of us did. Harry? I'm not sure I'm going to call him Tracy. I had to call a girl, but, yeah, I I'm not part."
Bonnie Nellsch,01;01;10;29,01;01;21;15,"I think, I don't really know what I had, but, I had a pretty much the first one natural, except for the last. And they gave me a shock, and I don't know what it was just a hell human."
Unknown Interviewer,01;01;21;17,01;01;24;06,"Probably. And, you know. Right. Right. Yeah."
Bonnie Nellsch,01;01;24;15,01;01;32;22,"hum. Yeah, yeah. And you just with her and the second one I had sister in section."
Unknown Interviewer,01;01;32;24,01;01;47;23,"The pregnant woman, for the contemporary of her problem, that's quite a bit like the spinal graph in my mind. What? For being born to have more."
Unknown Interviewer,01;01;47;26,01;02;11;17,"Because I don't have that much patience to go and I like them when you're sick and tired of whatever. Like, oh, I like I love it and they're happy a good day. They're only I don't like this disease. Like going back and forth like, all right, I'm."
Unknown Interviewer,01;02;11;20,01;02;18;08,"Not saying what. What about children? When you say it, would you like to."
Bonnie Nellsch,01;02;18;19,01;02;35;20,"I liked them when they were babies. And I thought they were really cute and everything. Until it got to be 2:00 in the morning, and I was trying to go to sleep. And you're so exhausted from when you first get home from the hospital and and, you know."
Unknown Interviewer,01;02;35;23,01;02;38;08,You I think you're back.
Bonnie Nellsch,01;02;38;11,01;02;43;02,"But I, I enjoy more as they're getting older. Seems like."
Unknown Interviewer,01;02;43;05,01;03;07;28,"I got a lot more future over what I couldn't play a game with them. They can sit and play games with us or when we go someplace for the four of us, we sing songs or or play guessing or bingo or something like this in the car. Work with your time and you're you're holding your hand when you're trying to keep them quiet for when you're going to grow up with their hands and bottles and."
Bonnie Nellsch,01;03;08;00,01;03;08;26,Home.
Unknown Interviewer,01;03;08;28,01;03;16;08,"Stuff along with her. It was so much more. Father, I guess. Yeah."
Bonnie Nellsch,01;03;16;10,01;03;23;04,"The whole grown up is sick to play here, and you have to sit there with a bottle, your baby on the other arm, try and play."
Unknown Interviewer,01;03;23;07,01;03;35;09,Cards at work. I am quite involved with my grandma collecting card cards and offering.
Bonnie Nellsch,01;03;35;11,01;03;40;27,And no baby was going to stop anybody.
Bonnie Nellsch,01;03;40;29,01;03;41;16,It's your whole.
Unknown Interviewer,01;03;41;16,01;03;50;26,"Family. Close. Yeah I am, I have a feeling that you're really. You're not only sisters, but you're a good friend. would say we're practically."
Bonnie Nellsch,01;03;50;26,01;03;53;00,Best friends to our. No.
Unknown Interviewer,01;03;53;02,01;04;05;08,"We are always close. Really? You know, I always see eye to eye with everything. Well, friends go. We're about to put a turtle right."
Bonnie Nellsch,01;04;05;17,01;04;08;19,"actually, I think we see more ideas than our best friends do, I think."
Unknown Interviewer,01;04;08;27,01;04;10;12,"Yeah, I think so."
Bonnie Nellsch,01;04;10;14,01;04;15;13,"Because I don't, I don't see that eye to eye with any of my friends."
Unknown Interviewer,01;04;15;15,01;04;16;26,"No, I don't."
Bonnie Nellsch,01;04;16;28,01;04;26;05,"In fact, I couldn't stand to be around any of my best friends as much as I could stand to be around my sister. Oh, my. You know, I mean, we see each other every day."
Bonnie Nellsch,01;04;26;20,01;04;33;08,And I could not put up with any of my best friends that much. Terribly. Would probably.
Unknown Interviewer,01;04;33;08,01;04;55;13,"Not. when you were growing up, did you have a garden? And did your mother always felt this having a nice personality? We have the garden. One is always calm and preserves. Yeah. Brought in from our master gardener. Huge garden for the whole family. With which it really got too much."
Bonnie Nellsch,01;04;55;16,01;04;56;28,And mom does go out there.
Unknown Interviewer,01;04;56;29,01;05;06;25,"Go to stuff now. More with the garden that you have when you're at home. And we're at home. when we were at home, we played a lot like Apple."
Bonnie Nellsch,01;05;07;02,01;05;23;11,"And there there were in our yard. There wasn't enough space for a garden, really. But now out at the farm, there was back there. They were always raising pounds. Were. So it wasn't garden material. I was I hated fields."
Unknown Interviewer,01;05;23;13,01;05;25;15,I you can't plant from.
Bonnie Nellsch,01;05;25;18,01;05;25;29,The ground.
Unknown Interviewer,01;05;26;04,01;05;41;28,"But the cows. grandma, grandma was buried like a cow, but her back half of my strawberry packs in hand forever. Now I have kind of a container for a matter, for doing beautiful. Drove the cows out marsh."
Bonnie Nellsch,01;05;42;00,01;05;46;06,I had coolers out there and they did the same thing. But did you?
Unknown Interviewer,01;05;46;08,01;05;48;10,So that move back from where.
Bonnie Nellsch,01;05;48;13,01;05;51;16,"I work, my design."
Unknown Interviewer,01;05;51;25,01;06;02;04,"do you do carry or things like that? I don't care, I like to bake bread. That's where in the winter I make it. My husband really enjoy it."
Bonnie Nellsch,01;06;02;06,01;06;16;06,"I think if I had my own garden, I might do that. But, even though we are a close knit family, I need to go out there all the time. Can I have these? Can I have that so I can take it home? Can you know, I'm sure they'd be more than happy to work with you. I know I."
Unknown Interviewer,01;06;16;09,01;06;34;01,"Feel I don't I don't know if it's your hamburger. I don't think it crosses the line. We went down. I have this bigger picture that we had after spending the money for the peaches on the right, evaluating my car. I've been doing some work on the gray."
Bonnie Nellsch,01;06;34;03,01;06;36;05,"Yeah,"
Unknown Interviewer,01;06;36;08,01;06;42;25,"Well, just the money was. It wasn't worth it. I figured can was check out my garage, cuz otherwise."
Bonnie Nellsch,01;06;42;25,01;07;02;00,"Well, as far as peaches go, my mom, she's can peaches too. She said you definitely don't come out money wise at all here. The only difference is it's so much better quality and the it tastes so much better. Other than that, you're not going on peaches, but on other things you might well, on my farm I know right to your."
Unknown Interviewer,01;07;02;02,01;07;24;25,"Farm out of the peaches I bought with me. And like on Clarkston it was in Moscow, so I don't know when they were picking. I know the plant was having picked recently, you know. Right, right. The prices were supposed to. Yeah. and I just, you know, we started thinking about this after fighting to get all of this done to and."
Bonnie Nellsch,01;07;24;25,01;07;28;28,For all the house we had to go through. It was was awesome.
Unknown Interviewer,01;07;29;00,01;07;55;20,"For that, for our my garden. Oh, can you do things you can't fulfill for your reason? Why do you say why or why you don't have any wheat bread? Yeah. It was it turned out really good. I enjoyed baking, but I do enjoy doing that. It's important to do it. Yeah, I remember mom was great. Grandma work a chore."
Unknown Interviewer,01;07;55;23,01;08;15;13,"But, you know, really, I really do enjoy. Yeah. My family have to eat the second bowl. when I started dating, I just. I said, it's a good thing I have a few other things to do. Otherwise we get spread coming on out of our ears. And I really had to scream. I, I."
Bonnie Nellsch,01;08;15;13,01;08;23;14,"Quit because, like I said, you get that fresh bread and I can eat a whole loaf myself practically after comes out of the oven with butter, you know."
Unknown Interviewer,01;08;23;16,01;08;46;20,"That's right. But I, I can I wouldn't stop myself to do that. But I got where I was baking every time I baked bread. I had to give a lot. so. And so I had to figure out that this one. So it really girl. But it's like you're done not having that for your family. Once you give them their one compliment or, you know, where are you like to try different recipes."
Bonnie Nellsch,01;08;46;22,01;08;47;19,Definitely.
Unknown Interviewer,01;08;48;12,01;09;10;29,"yeah, I do. My husband is taking care of me and so he doesn't really enjoy it as much, right? Yeah, I do, you try different recipes for your bread. I see, I, I've tried and like I said, I make the wheat bread from Brown County. I make some bread. I like bread."
Bonnie Nellsch,01;09;11;01,01;09;13;29,One recipe.
Unknown Interviewer,01;09;14;01,01;09;16;26,Yeah. Just take out one like. Good.
Bonnie Nellsch,01;09;16;29,01;09;18;17,Yeah. You just take out one loaf and roll.
Unknown Interviewer,01;09;18;17,01;09;20;16,Out and put your cinnamon and sugar on it.
Bonnie Nellsch,01;09;20;20,01;09;26;07,Oh a little water and rough it up and she. That's good.
Unknown Interviewer,01;09;26;09,01;09;36;07,And especially with great. Yeah. I don't know how to do that there. I think I do too long or I do.
Bonnie Nellsch,01;09;36;09,01;09;47;17,"It's kind of a hassle sometimes. Well, not so much now, but when the kids were younger, it was a hassle because you all like running out from. But now they pretty much, entertain themselves. So you can do it better too."
Unknown Interviewer,01;09;47;17,01;10;10;00,"But now we can make breakfast with pies, and you don't go after you get the ball. You can play with that. Go back to the pie for hours and kind of pick up on that. It really keeps losing weight. Consider that. Don't keep people more disease and then some expensive course you've got."
Unknown Interviewer,01;10;10;03,01;10;33;05,Them for ones who are not very often you don't have the patience to let them do it for everyone. Far. help help make cookies soft is more supervised. You may love the fact that you get to offer some there. I think you might do that. You should do most of your cooking. Good. Scratch.
Bonnie Nellsch,01;10;33;08,01;10;35;14,"Yeah. Oh, yeah. No, I don't like can."
Unknown Interviewer,01;10;35;14,01;10;39;08,"Except cake cakes, I."
Bonnie Nellsch,01;10;39;10,01;10;39;22,Do.
Unknown Interviewer,01;10;39;25,01;10;43;25,"I always find cakes where I do what I use, I don't."
Bonnie Nellsch,01;10;43;27,01;10;47;25,"I don't, I don't believe in like wine cans to and all that garbage, you."
Unknown Interviewer,01;10;47;25,01;10;57;12,"Know, I know garbage. That's refreshing. Okay. Right. And and from there in there. Right. You know, from over there, I have to be about everything."
Bonnie Nellsch,01;10;57;14,01;11;15;09,"Well, I have plant and canned vegetables. Okay. Oh, I like frozen vegetables better, but. And, canned soups. But that's about as far as the can stuff goes, you know? But I use soup and cooking too, though. Okay. I don't like, but. Right. I want."
Unknown Interviewer,01;11;15;09,01;11;15;28,To camp on a.
Bonnie Nellsch,01;11;16;04,01;11;18;12,Hand vegetable for months.
Unknown Interviewer,01;11;18;15,01;11;24;08,"I want to tell you that things are the dinners that are, you know, I or I."
Bonnie Nellsch,01;11;24;10,01;11;28;19,"Oh, frozen dinners and Hamburger Helper. now, I don't use that."
Unknown Interviewer,01;11;28;21,01;11;41;16,"Yeah, yeah. I guess this is a kind of a bad question. That's informative. Have you ever thought about what you would do if something were to happen to your husband?"
Bonnie Nellsch,01;11;41;19,01;11;58;26,"Oh, yeah. Sure. Only for I work from a financial standpoint, what I would do to carry on afterwards. But other than that, I mean, we just sat down and discussed what we would do and what my. Oh yeah, and what he would want me to do and what I would want."
Unknown Interviewer,01;11;59;00,01;12;02;13,Do you mind going into that?
Bonnie Nellsch,01;12;02;16,01;12;32;14,"Oh, I don't mind. now with, for instance, if he were to die, we would, we would discuss how much the insurance would cover on, any bills that we might have and how much the insurance. I would get money. And, I would, pay the house up a couple years in. Most things we have have an insurance on that would pay him off if I had any debts at the time, and then I would go ahead and wait till the girls were both in school."
Bonnie Nellsch,01;12;32;14,01;12;49;17,"And then I would go to a nursing school and, get married. And that's what I would do now if I were to die. I told him you would. Naturally, you would have that big of a problem as much as a wife would, I don't think, because he would still have his job and he would just carry on."
Unknown Interviewer,01;12;49;20,01;12;52;01,And probably to find he would be careful.
Bonnie Nellsch,01;12;52;04,01;12;55;17,"Right. That would be his main problem. Whereas me, I'd be a little harder."
Unknown Interviewer,01;12;55;21,01;13;27;26,"Yeah. I guess your problem would be, if I was to die. There won't be during that here. Yeah. So there's never a way out. So we have kind of a situation where the worst happens. You guys, I just, I roll over my grave very regret. The girl, the car would really be bad if they were separated, so I don't know how things would turn out."
Bonnie Nellsch,01;13;27;26,01;13;30;07,Their their wives legally could get.
Unknown Interviewer,01;13;30;14,01;13;43;13,"Yeah, you could legally have her. Although you never had a great year. Oh, no. well, I don't know how many you ever had or something like that, but that would be your own problem with trying to carry."
Bonnie Nellsch,01;13;43;16,01;13;45;01,So what? What do I have to.
Unknown Interviewer,01;13;45;01,01;13;49;28,Do if I'm happy to be out?
Unknown Interviewer,01;13;50;01,01;14;00;22,"Man. And I, I'm not a person to live by myself. I like the people I married."
Unknown Interviewer,01;14;00;25,01;14;08;11,"Well, I need you to support you. I like to have a man there to lean on. If something comes up, I. Well, I."
Bonnie Nellsch,01;14;08;11,01;14;16;17,"Have to, but my first thought wouldn't be the man. My first thought would be to handle my own life. I would have to grab whoever came."
Unknown Interviewer,01;14;16;19,01;14;40;05,"I would grab just over the came along. I would have to be, first man. That would be right for the kids and for you and for me. But I would never. What would I want you to do if that were correct? For 2 or 3 years? Oh, I mean time. What would I do? I really have no, I have no idea what for sure I would do."
Unknown Interviewer,01;14;40;05,01;14;48;22,"I retired from some, after the kids are in school over with my school. I tried to find something for this."
Bonnie Nellsch,01;14;48;24,01;14;51;16,"Well, you could live on Social Security and."
Unknown Interviewer,01;14;51;19,01;14;58;24,"I don't know, like it or not, you know, if you have kids, social security for tracing for myself. But I really could carry it."
Bonnie Nellsch,01;14;58;24,01;15;01;17,You just have to trust me.
Unknown Interviewer,01;15;01;19,01;15;32;12,"This friend of the situation right here, this area is not at all interesting. It's really sad because I work for him. If you have one from senior, but he was not very nice. last time he was here was in January and he was in there volunteers to do two characters in Iraq he was more worried about,"
Unknown Interviewer,01;15;32;14,01;16;01;06,"Bringing her arm in her back, which I was really, hurt over that because you would have thought, you know, he definitely ran worth more than he did. That means he was actually really impressed with your senior. But, I guess he was more interested in your father, who? So I'm hoping eventually that you will find out your doctor visits and central figure."
Unknown Interviewer,01;16;01;09,01;16;22;25,"Yeah. And every month, I think he was wearing the service. So we're going out about five months. He's been out. I haven't come out for five months. Going forward. You just automatically took it out. Check. Checking out my wife sometimes is concerned that, like."
Unknown Interviewer,01;16;23;04,01;16;47;22,"the directions the the child support I kind of ways that that kind of these. Yeah. Yeah that to you I, I think if I remember right there was it has to be over a certain amount and you doesn't pay over this amount to be able to have the right to clean up at that. He was trying to tell me he's happy, right?"
Unknown Interviewer,01;16;47;22,01;17;06;17,"I don't want to do it. He wouldn't want who I knew. So I'm not going to say could claim ma'am, I refuse to. And have to back. Up."
Unknown Interviewer,01;17;06;20,01;17;14;12,He was so very seldom. I'm not very there now.
Bonnie Nellsch,01;17;14;12,01;17;38;07,"I don't watch it at all. Hardly. During the day I have. I do have one so far that I watched that this. I try to keep it just did the one because you could really get involved in them all if you let yourself. And I just can't sit during the day and continuously watch show after show after show and at night when they're on food 11 fifth, then sometimes I'll watch a good movie if that comes on."
Bonnie Nellsch,01;17;38;14,01;17;42;19,"But if there isn't a good movie, I don't want to watch it. I just soon read a good novel."
Unknown Interviewer,01;17;42;21,01;17;43;19,Did you watch TV?
Vicki Mitchell,01;17;43;19,01;17;48;10,Very much. When you're gonna.
Vicki Mitchell,01;17;48;12,01;17;49;05,Read I know.
Unknown Interviewer,01;17;49;05,01;17;50;29,"I know, I was too involved in score."
Bonnie Nellsch,01;17;50;29,01;17;56;07,"And if I wasn't doing schoolwork, I was getting ready to go out on a date."
Unknown Interviewer,01;17;56;09,01;18;01;00,On a very different.
Bonnie Nellsch,01;18;01;02,01;18;11;14,"Yeah. Oh. Any specific program? You mean that is about cold, Jack?"
Bonnie Nellsch,01;18;11;16,01;18;14;21,And I read watch it faithfully. I just watch it once in a while.
Unknown Interviewer,01;18;14;24,01;18;20;19,Know nothing I can do that I watch for there is any other except for all my children. Like I said during.
Bonnie Nellsch,01;18;20;19,01;18;26;19,"The day, I don't even watch it faithfully for catch up on it three weeks later and I haven't."
Unknown Interviewer,01;18;26;19,01;18;35;21,Missed that much. I think I can read I something's wrong. Try it. I've never like just to have a great I like how and not a lot.
Bonnie Nellsch,01;18;35;24,01;18;43;03,We all read all three of us and we switch back and forth on our books. So.
Unknown Interviewer,01;18;43;05,01;18;47;04,What types of novels do? Mostly gothic.
Bonnie Nellsch,01;18;47;06,01;18;49;04,But not me. Her.
Unknown Interviewer,01;18;49;07,01;18;52;04,I don't go the Gothic.
Bonnie Nellsch,01;18;53;24,01;19;04;25,"I like novels now. right now I read in Mandingo, but it was one of her husband's books. Now I like it real well, I know, have you heard of him? Mandingo. The black son. Falcon. Her falcon was fancy."
Unknown Interviewer,01;19;04;27,01;19;05;27,Her movie?
Bonnie Nellsch,01;19;05;29,01;19;34;09,"Yeah. Now, that's why I'm reading now. Because I want to read it before the movie gets here. Not here. Spokane. Never take another year before. I see what I mean. Yeah, and it didn't even say where it would be. It just said, the Columbia Basin area. I think, know, yeah, I like, oh, I like, I don't like just romance."
Bonnie Nellsch,01;19;34;09,01;19;45;26,"I mean, I like a romance in my books, but, I mean, I like it, a novel, like I said, not just a short story, but I know there has been several romance a series or something."
Unknown Interviewer,01;19;45;29,01;19;50;26,So what do you like about Girl?
Unknown Interviewer,01;19;50;28,01;20;10;01,"Oh, I don't know. I suppose because there's some romance it doesn't get real mushy or I think it's like romance and you don't from the side behind it. I guess. Yeah. Simultaneously. I always feel."
Vicki Mitchell,01;20;10;15,01;20;17;15,"Caught magazine for a different day, Right."
Unknown Interviewer,01;20;17;17,01;20;24;08,"Coming here as we get right here. Back down here, I love. Yeah. Same here. I don't prescribe movie."
Bonnie Nellsch,01;20;24;08,01;20;26;08,Magazine.
Unknown Interviewer,01;20;26;10,01;20;30;01,Here. Where everybody man at random.
Bonnie Nellsch,01;20;30;01,01;20;30;23,No.
Unknown Interviewer,01;20;30;26,01;20;42;23,"No. Of course. Why am I here? To buy True Detective, I don't know, I."
Unknown Interviewer,01;20;42;25,01;20;56;22,"Wish your father involved in crime more. Yeah, I think so. It. World War two."
Bonnie Nellsch,01;20;57;05,01;20;59;11,he was in the Navy.
Unknown Interviewer,01;20;59;13,01;21;03;16,So I don't remember time. He was in World War two. I know that.
Bonnie Nellsch,01;21;03;16,01;21;06;14,"Because he was on, on a,"
Unknown Interviewer,01;21;06;17,01;21;14;02,"Aircraft aircraft carrier. And in World War II, I don't remember that. I said, of course you don't remember that."
Bonnie Nellsch,01;21;14;09,01;21;19;19,"Oh, my. No, we don't remember it. I just know it because he told us and he showed me pictures."
Unknown Interviewer,01;21;19;21,01;21;23;09,"Yeah, I see that. But I don't know, I."
Bonnie Nellsch,01;21;23;11,01;21;28;06,"I, you know, but in that was one of the reasons I want to go in the Navy."
Unknown Interviewer,01;21;28;09,01;21;31;00,"But my dad,"
Vicki Mitchell,01;21;31;02,01;21;36;05,What happens when you think about Vietnam for.
Unknown Interviewer,01;21;36;08,01;21;54;29,"Rich man's war. Oh. How are your in spirit, rich man's war? I come home for over two years. They're so, so like. And he thought it was worth it at the time. I can't be proud. I think they they feel like."
Unknown Interviewer,01;21;56;05,01;21;58;25,Larry thought it was a big letdown. Yeah.
