speaker,start,end,text
Audrey Winter,00:50:50:05,00:51:05:25,"I've got to do this for my family. their needs come first. I mean, you know, and then I just kind of work myself in as graduate schools. And that's one of the lessons I think you have to learn is."
Audrey Winter,00:51:05:27,00:51:12:20,Is just it's an honor for her. And to be conservative.
Unknown Interviewer,00:51:12:23,00:51:23:22,"Have you found it? Perhaps a little more private and lonely than you'd like, you know, or lonely or so maybe she'd have to."
Audrey Winter,00:51:23:25,00:51:53:03,"Be aware of and be prepared for. Like I say, in, like in our sophomore year in our freshman class, we thought we had turned into a good person, which is a gigantic. But for them, it was pretty good size for the rest of the school. And so and I knew just everyone in the school and everyone knew me and I wasn't involved in everyone's life, and I was just constantly with people learning to be with them and a part of their life."
Audrey Winter,00:51:53:03,00:52:20:14,"And they were a part of my life. And now it's like, I mean, you have a lot of courses like this. I mean, even in school, you have a few basic things that are to and but there's other people you can be involved with and they're interested. They like volleyball. You can go play longer or whatever. But here you you have to accept the fact in irritating yourself, and."
Unknown Interviewer,00:52:20:15,00:52:25:12,You learn to be a more self-sufficient.
Audrey Winter,00:52:25:14,00:52:37:06,"And the interest that you have by yourself, I mean, you have to work for sure. So or bake. Yeah, I."
Audrey Winter,00:52:37:08,00:52:45:12,It's to answer an adjustment every people people look at this like this I better think about it really hard.
Unknown Interviewer,00:52:45:15,00:52:54:25,In your in your particular family right now. I know you and your husband go work. Do you go take care of the finances and talk about that.
Unknown,00:52:54:27,00:53:05:29,"Well running the house here I'm going to the Bible says the man of the household. And, I'm right, more spiritual."
Audrey Winter,00:53:06:01,00:53:28:25,"In fact, be taking care of the money there time. And but I am doing things about this great. I mean, if I want something, he don't say, you know, I don't have to go and ask him for a dime to go. But the basic decisions are what bills to pay and whatever is right. I mean, he's just the boss and that's the way it is."
Audrey Winter,00:53:28:27,00:53:42:04,"Of course. I can sit down and say, aren't these things? Or do. And as far as I, I manage it in that area. But if he comes in and he says no, I want to keep this money on."
Unknown,00:53:42:06,00:53:46:13,You're not doing that. And that's fine. I right.
Audrey Winter,00:53:46:16,00:54:09:15,"And our, our money just goes together and we just go I mean I don't consider it as my money. Yeah. You know, you have no right to it because he brings his home and gives it to me. And so. All right. It's just kind of a cooperative type with him. She's having her final word. You're saying, you know."
Unknown Interviewer,00:54:09:17,00:54:13:12,For is a sharing right in the decision making.
Audrey Winter,00:54:13:12,00:54:23:03,"You're right. A lot of times I would like to do things a little bit more differently, but I figured, well, who knows for."
Unknown Interviewer,00:54:23:05,00:54:25:04,Them that it works out.
Audrey Winter,00:54:25:07,00:54:28:19,"Yeah, I might go in there resenting it a little bit."
Unknown Interviewer,00:54:28:19,00:54:30:05,Sometimes I don't want to do that.
Audrey Winter,00:54:30:05,00:54:57:26,"But, as far as. Like for the grocery shopping or whatever, like we go and if he goes into the store, he just drives me crazy because he picks up, you know, you have to buy a case of this and that, you know, and, because we're trying to make something that here clothing sitting there can $8.89,"
Audrey Winter,00:54:57:28,00:55:24:20,"But yeah, we learned about people like that for the first few years of our marriage. It wasn't that way. I oh, I worked some, but it's been more so in the last year. Like, I don't know. So I work and do the same type of thing that he does. And he's had to learn to do the same type of thing to to be a housewife home like he was taken up to a year ago."
Audrey Winter,00:55:24:22,00:55:45:00,"And what we both had this morning, turning the bronchitis thing. Well, the doctor just told me, go ahead and work because I would be behaving if I was home anyway. So, he stayed home one day, and when I came home from work, he had the house cleaning the floors more. He, had dinner on the table. Oh, wow."
Audrey Winter,00:55:45:00,00:56:11:27,"Things I would have done if I had been here for him. And, he can, I cannot him for work cares for me while I was working on, like, just, you know, whatever I would have done it, too. And I think this is a real blessing. You learning to share both sides. Because when a lot of the women that work around here, they go home and they have everything to get, and it was that where you would be."
Unknown Interviewer,00:56:11:28,00:56:14:01,For years because to.
Audrey Winter,00:56:14:03,00:56:31:17,"But I think that he's really realizing, you know, that I am a person with real feelings. I'm not just a woman anymore, you know what I mean? And that's really great because, you know, it's it's quite a burden. I mean, you know, you're mutual caring, not just."
Unknown,00:56:31:20,00:56:38:13,"Knowing that there are some finances, but the lifestyle changes and you, you gain."
Audrey Winter,00:56:38:13,00:56:58:02,"More that maybe I've learned this is not always fighting for what I'm fighting for my rights. You better don't do this to me. And I'm not going to let you get away with that. I've learned if a woman is really smart, she doesn't have to think you're great. All you have to do is figure something and let it go."
Audrey Winter,00:56:58:04,00:57:26:17,"And you know, it's funny. Yesterday you done or your opinion on something you can say or I disagree with you and I feel this way about this person or that thing, you know, all this. Then later on the well, you know, I think I was wrong about some, you know, it doesn't always work like that, but this has been a lesson for me to because being a spoiled brat, I just demanded that everything was my own way."
Audrey Winter,00:57:26:19,00:57:44:23,"And then for a long time it went, but nothing was my way. He was going to show me that I couldn't be that way. No, no was just come back for part. And he can do that a lot. It's not to, you know, it was you know, a lot of women are getting more salary involved. You know, if someone's hurt, I cry with them."
Audrey Winter,00:57:44:23,00:57:54:13,If they're they're laughing I laugh with him. You know he's a put it on. All right. Now you really know what that's going to be all right. Yeah. Just break down.
Unknown Interviewer,00:57:54:16,00:58:05:00,"You know, going to. That's okay. Look out. They always want what you don't put yourself in."
Unknown,00:58:05:02,00:58:12:05,Know everything for in therapy.
Unknown Interviewer,00:58:12:07,00:58:16:00,"Yeah I know yeah, yeah. It's obvious. You know, blue eyes or."
Audrey Winter,00:58:16:06,00:58:19:15,Anybody else that have blue eyes. Ones brown eyes is strange.
Unknown Interviewer,00:58:19:22,00:58:26:24,"Oh. Is your husband as active as your in the church, Christian? No."
Audrey Winter,00:58:29:03,00:58:49:11,"sometimes you have calendar has the same, you know, it's just different to be for a man to be involved in the church, you know, and to be involved in these activities plans."
Unknown,00:58:49:13,00:58:53:24,"Yeah. So,"
Audrey Winter,00:58:53:27,00:59:12:03,"I think this is talk to the line, but we agree. Basically, when we got married, he was Catholic and I was working for him, and we could not get along at all. And since then we have. Excuse me."
Unknown Interviewer,00:59:12:06,00:59:16:16,But it's okay.
Unknown Interviewer,00:59:16:19,00:59:17:10,Well.
Audrey Winter,00:59:17:12,00:59:29:07,"I mean, he doesn't inject too, you know, like having the Bible study here. And a lot of the times the person enjoys it. I, I think as far as Christian growth, I probably."
Unknown Interviewer,00:59:29:10,00:59:34:24,"Have more growth in you guys. But, but mostly in college, the women that."
Audrey Winter,00:59:34:24,00:59:39:18,"Yeah, right. You know, there aren't too many memorable. They're involved, but they're, you know."
Unknown Interviewer,00:59:39:18,00:59:45:28,"Standoffish. That's, I don't know."
Audrey Winter,00:59:46:01,01:00:11:12,"It's just strange. Like in your congregations, in any church, there may be one of them. And I think it's maybe we've noticed our weakness faster, that maybe we are not all but three. But the ones that are there know we need someone else to that will ever face. And God. And I mean, you know, he's he's the only one that's been changing every human being let you down in one way or another."
Audrey Winter,01:00:11:15,01:00:36:20,"You know, and business, you know, knowing that you always have heaven, no matter if everyone else in the world is keeping. And he'll listen whether you're ranting and raving or crying. I mean, he's always there and he always has an answer. You might not always be the answer that you think it should be, but in the end, it always works out."
Audrey Winter,01:00:36:23,01:00:39:03,Even if you break your know.
Unknown Interviewer,01:00:39:05,01:00:42:08,"And that's just to slow you down a little, right? True."
Unknown,01:00:42:10,01:00:50:11,You do. And.
Unknown Interviewer,01:00:50:14,01:00:58:29,They have pretty good playing together and oh I found some hate there. Any jealousy between the middle Eastern.
Audrey Winter,01:00:59:02,01:01:12:22,"I mean you know for almost seven years that they in here comes in a monster home away and that she's very overprotective. Anyone else? She just acts like his mother, like."
Unknown Interviewer,01:01:12:23,01:01:14:01,"Oh, she."
Audrey Winter,01:01:14:06,01:01:16:20,"Runs right in when I go, oh, don't do that."
Unknown Interviewer,01:01:16:23,01:01:18:18,"Oh, know I'm sorry."
Audrey Winter,01:01:18:21,01:01:26:05,For your son ever being with her. She. Of course she. When she says it's all right.
Unknown Interviewer,01:01:26:07,01:01:45:01,"Yeah. Oh, look at record. That's cool. Please get a fresh. Oh, that's all right. It's stayed in I think it. Where you're."
Audrey Winter,01:01:45:03,01:01:47:18,Oh in. They're missing it. I can't figure that out.
Unknown Interviewer,01:01:48:20,01:02:02:26,yeah. She that's mostly most of the questions.
Unknown Interviewer,01:02:02:28,01:02:13:04,"On she they don't give me an talk about,"
Unknown,01:02:13:06,01:02:15:03,Know. Oh. See.
Unknown Interviewer,01:02:15:06,01:02:31:28,Here's where I could ask you. How would you compare the life of her rural women with that of urban women? Capital. Yeah. Just. Would you rather live in a city than out in a rural area?
Audrey Winter,01:02:32:00,01:02:54:18,"There are times that I miss pretty good. I miss, I guess the point that I really miss is being able to go down and just spend like an hour or two just looking in shock and enjoying, you know, you're once in a great while, like some of us women will go to school, parents spend now, this is just fantastic to be away and to look at it."
Audrey Winter,01:02:54:18,01:03:18:28,"Styles. I mean, a lot of times we're out of touch with a lot of things like that. But Saint Mary's is real limited on what they have. You know, on buys and bargains, you know, just anything. And I miss being able to just window shopping and just a lot of things like up here, you realize, oh, well, I need a pastry brush and, you know, I'm going to get a pastry brush when I go to town."
Unknown Interviewer,01:03:19:02,01:03:19:23,Yeah.
Audrey Winter,01:03:19:25,01:03:41:14,"You get in town and you have your grocery shopping. Do you have different errands to run? And by the time that you get there, you're so exhausted and done so much, you're just ready to go home. Is that what you wrote? Yeah, right. You know, in, in in a city, if you want something, you feel good out of town on to it and you'll just run right down there and do it."
Audrey Winter,01:03:41:16,01:03:56:23,"If you run out of yarn, we just run to the store and bring back know well here. Sometimes here in the winter time, it's only like twice of our work. Yeah, yeah. You know, kind of like gets me down. I don't like that too. But yeah, you know that that part of."
Unknown Interviewer,01:03:56:23,01:04:04:04,"It I, I grew up pretty severe winters, a lot of snow. Yeah. We're gonna get snowed in a lot."
Audrey Winter,01:04:04:08,01:04:33:26,"Yeah, they keep us quite out of it now. It's still, you know, it's 25 miles over there, you know, driving next to the river. It's just not something that I don't drive a lot in the wintertime. You know, we get our four wheel drive and I think. I just don't like to drive on snow all that well. And, you know, all of us around here, after the snow really comes, we just kind of go, don't we don't do that much."
Audrey Winter,01:04:33:26,01:04:45:15,"And we try to get different things going around here to be involved in, like playing volleyball. And this year we're gonna try something different."
Audrey Winter,01:04:45:17,01:05:08:25,"I mean, you know, they don't want to be involved. And so when I came to Saint Mary's and I was like in the chorus and things, they weren't even sure that anybody was going to be there for the performance. I mean, you know, the director was really right. I mean, are you going to show up? Oh, you know, well, in the winter, 25 miles to come, you know, you can't depend on everyone."
Unknown Interviewer,01:05:08:28,01:05:10:22,So the winter sounds like kind of a slow time.
Audrey Winter,01:05:10:22,01:05:31:13,"Yeah. Right. And so if the kids are involved in there and they missed the bus, if they have a practice for this sport or that sport, you do, they have to find only one. Their parents have to go get a room driver's education. Like for the kids out here, the parents like Hansen and some the other ones in here, it had to go in 2 or 3 times a week to pick up their kids, take turns."
Audrey Winter,01:05:31:13,01:05:36:18,"I mean, you know, that's a real burden on the parents. Of course, that's the price you pay for living."
Unknown,01:05:36:18,01:05:41:14,Out here to. But I would.
Audrey Winter,01:05:41:17,01:05:42:07,I want Nancy.
Unknown,01:05:42:09,01:05:47:06,And John have more of a challenge and it would be less.
Unknown Interviewer,01:05:47:08,01:05:51:11,"So maybe you would encourage them not to live in a rural area, or really run."
Audrey Winter,01:05:51:18,01:06:04:13,"Right until they decided for themselves. This is really what they want. You know, I'd like him to go and just travel, you know, just, see what what the ocean looks like or."
Unknown,01:06:04:16,01:06:10:14,"You know, I mean, my mom and I, we traveled after dad died each summer."
Audrey Winter,01:06:10:14,01:06:17:28,"We spent, like, three months away from. And we went in California and we just enjoyed ourselves."
Unknown Interviewer,01:06:17:28,01:06:19:15,It makes a difference.
Audrey Winter,01:06:19:17,01:06:24:04,"And, you know, found out with the rest of the world was like, I can look back and say, well, I didn't know I'm."
Unknown Interviewer,01:06:24:04,01:06:29:11,"Going to be able to see a big city and say, I don't want to live there because I've seen one."
Audrey Winter,01:06:29:14,01:06:51:13,"Right? Not because I'm just frightened of the idea of living in a big city. I know what it's like. I don't like it. Yeah. But a lot of these kids around here. They don't have any idea. I mean, this is their world. This valley. They've never. My husband has never been anywhere in all his years of his life."
Audrey Winter,01:06:51:13,01:07:05:09,"I mean, he's, the first time he went to Montana since we've been married. Oh, I mean, you know, he just hadn't went anywhere at all. And so all you really know just. Is this valley and this area."
Unknown,01:07:05:11,01:07:15:26,"He's. You know, I want more than that for my kids. I want him to have a chance. But I have two things inherent in making decisions."
Unknown Interviewer,01:07:15:28,01:07:26:19,"When you were talking about, in Saint Mary's, you were just near the hospital. Do you have good medical service in this area, or is Saint Mary's the closest? It's the."
Audrey Winter,01:07:26:19,01:07:45:07,"Closest. It's improving. They brought a new doctor in in the last, four years or so. But the other doctors there are older, you know, just them and doctors. And it's probably the younger one here and with the newer techniques."
Unknown,01:07:45:07,01:07:50:05,"And he has taught a lot of the other doctors, you know. So but,"
Audrey Winter,01:07:50:07,01:08:05:03,"If he wasn't there, most of the time, the people just they don't want to go there. I mean, if it's going to be in the hospital, they don't really care for the state. Various hospitals because of the, just the attitude."
Unknown,01:08:05:05,01:08:11:12,"Of a lot of the nurses and things in there. There was a man, old Daniel back, that lives down here. He came from."
Audrey Winter,01:08:11:15,01:08:15:04,"Yugoslavia countries or something like that, and he's lived here for years."
Unknown,01:08:15:04,01:08:20:25,"For the first time in his life, he ever had to have anything wrong. He went into the hospital and they had to be."
Audrey Winter,01:08:20:27,01:08:39:22,"Balanced or something. And, he was just so new and so different to I mean, he didn't understand. He's 80, you know, and they were just so cruel to him, you know? Well, just shut up and be quiet, you know, and leave him back there and just, you know, I mean, well, they're in their profession to be merciful for people that need it."
Audrey Winter,01:08:39:22,01:08:47:19,"Yeah, well, they're not. So, so we just as soon go to court or someplace, really, when it came right down to it for hospital. Right."
Unknown Interviewer,01:08:47:20,01:08:50:18,"Yeah. So if it was, unless it was something really slight."
Audrey Winter,01:08:50:24,01:09:12:23,"Yeah. I probably wouldn't go in there. I had to have hand surgery on my hand this summer. And after he rates and sent me to a specialist in Portland and they put me in hospital over there. And the difference in the treatment was so fantastic. I mean, I had never been in any of the hospital, referred to Saint Mary's going to have the children and stuff and, you know, you're treated like a human being."
Audrey Winter,01:09:12:25,01:09:17:21,And I think they've lost the personal touch knowing that they're the only one. So they kind of got you over there.
Unknown Interviewer,01:09:17:24,01:09:22:08,"Well, how did they treat you when you went in to have music?"
Unknown,01:09:23:03,01:09:32:17,"I was in the preschool. I was, you know, they were just summer nights. I mean, you can't say that. All of them were like, when I went in."
Audrey Winter,01:09:32:24,01:09:51:18,"That we had paid $20 a special seat, have the X-rays read by a technician because they assumed that I was going to have twins because I got so big. Fancy. Well, it wasn't. She was a 10th baby. If she'd have been 5 pound baby, I can head her. That would have made a difference. But letting her go over so long is what made it put on all that weight."
Audrey Winter,01:09:51:18,01:10:01:24,"And the X-rays said on there that I could never have full the doctor believe that it was wasn't that way. He was. Oh, anybody can do it."
Unknown,01:10:01:24,01:10:07:04,"Might be a little bit near but we'll do it anyway. So we done it. I mean, you know."
Audrey Winter,01:10:07:06,01:10:21:15,"The other it was his day off and he was out with his horses and he spent all day here. There. He came to visit me at 6:00 in the morning. And that was the only time I seen him until this other doctor came in, which had been my, husband's family doctor for years."
Unknown,01:10:21:18,01:10:26:27,"And he took him outside and he said, now, listen, your wife and that baby, I've been doing something right now."
Audrey Winter,01:10:27:00,01:10:28:24,I'm here. We'll do whatever you have to.
Unknown,01:10:28:24,01:10:32:09,"But he don't know. Let her go on any longer, you know."
Audrey Winter,01:10:32:12,01:10:45:19,"And so he calls him up and he says, you better get up here. This girl's dying. Yeah. So they pair up there and they. Oh, yeah. Well, we've been rush right into emergency surgery right now. You know, here I am. You know, after 17."
Unknown,01:10:45:19,01:10:52:25,"Hours of hard labor, I'm laying there terrified. I don't, you know, and when I got out, you know."
Audrey Winter,01:10:52:27,01:10:58:25,"Of course you going to be kind of babyish at 18, you know, you don't know what's coming off of you in the first place."
Unknown,01:10:58:27,01:11:06:01,"And they were some of them were really nice, like I said. But other ones, they come in and."
Audrey Winter,01:11:06:03,01:11:21:12,"They, I didn't know that I was supposed to have a binder on. Hold your them together when you have something like that. And they just took me over on my side. Well, my insides just went flat with me. They go, oh, yeah, well, we'll find her on her. Oh, you know, I mean, this was her attitude. Oh, well, flop her back over."
Audrey Winter,01:11:21:12,01:11:23:20,Do it. You know. But when I had.
Unknown,01:11:23:20,01:11:30:14,"John and Doctor Hendrickson being different, he's done my hair out. Perfect."
Unknown Interviewer,01:11:30:16,01:11:34:24,"Oh, yeah. With John, they were better, though."
Audrey Winter,01:11:34:29,01:11:50:00,"Yeah, well, it was a different I. And this is the new doctor that came in. And he's the type that, you know, if you walk in and you say, well, if I have been able to get this I.V. out of my arm, you know, it's all swelling up all day long. And here it's been in there, you know, like it for 3 or 4 days."
Audrey Winter,01:11:50:00,01:12:04:13,"You have Kevin after C-section, and my arm is swelling way up when it's red. And they said, well, we can't take it out until Doctor Who works. And Kevin checked. Well, he had him take it out and then he just went out there and jumped over those nurses. And you knew if it was important, all you had to do was call me."
Audrey Winter,01:12:04:16,01:12:19:12,"So they straighten up, you know, and, so it's it's progressing. You better. But I think it'll be a lot more so when the older doctors retire in, you know, they're once again everyone saying, well, I know that they must be."
Unknown,01:12:20:01,01:12:25:10,"a lot of, you know, two of you, I'm sure, over 60."
Audrey Winter,01:12:25:12,01:12:38:12,"Or if that one is and he's he's close to it. And the others in or nearing that there's there's three of their family. 15. You know. So. And one Doctor Hendrickson is, you know, sometimes."
Unknown Interviewer,01:12:38:14,01:12:40:06,Good heavens. So it's really.
Unknown,01:12:40:06,01:12:47:12,"I mean, you know, there's they need some new, new people and there's only."
Audrey Winter,01:12:47:12,01:12:51:14,There's only four doctors in the town. There used to be one other one that had a separate.
Unknown,01:12:51:14,01:12:55:12,"Clinic, but then he."
Unknown,01:12:55:14,01:12:58:15,Said it's just too.
Unknown Interviewer,01:12:58:18,01:13:02:26,"Well, are there many accidents, like with the mill or. Like the railroad?"
Unknown,01:13:02:26,01:13:13:15,"Yeah, they're not too many. The mill. There's been an accident. My husband was hurt down there. Is they."
Audrey Winter,01:13:13:20,01:13:29:15,"There was a shaft that was going. Man always stopped the slide, took out a bundle and come back. Nails went like this with nuts with your hands around it to stop the shaft. It was just barely turning. Rubber gloves section. It went around like that. And with his fingers. Well, you know, they were real good to me."
Unknown,01:13:29:17,01:13:36:06,"And and everything, but, you know, it's that's quite a ways to go have an accident."
Audrey Winter,01:13:36:06,01:13:42:09,"It happened in this man right here in this trailer, working and then taking over. He reached around the side."
Unknown,01:13:42:09,01:13:48:04,Wipe off the glass like that. The section is closed down there and old has left in his right hand. Is this.
Unknown Interviewer,01:13:48:07,01:13:50:08,"Oh, you know, that was some four, five."
Audrey Winter,01:13:50:08,01:13:56:21,Years ago and it's still not healed. There's been with this in with other mills.
Unknown,01:13:56:21,01:14:03:05,"Aren't years bad. Now we're going to where Hamlin's just came back from down in St Rincon. They had a man that, the mill right turns on."
Audrey Winter,01:14:03:05,01:14:12:27,"Or just, you know, cut his arm off. Oh, director. And watch you, of course. Or when chased him off. I mean, you know, you don't want to make that's accident prone like that around there. Oh, yeah."
Unknown Interviewer,01:14:12:29,01:14:17:06,"No, you know, it's just. That's terrible."
Audrey Winter,01:14:17:06,01:14:26:16,"Right? Oh, oh, oh, a lot of us women here, we went into the hospital and we had, some of the nurses and."
Unknown,01:14:26:22,01:14:31:06,This one other kid that went in to work on insurance or something.
Audrey Winter,01:14:31:08,01:14:33:25,And we bought a respirator. The ladies coming.
Unknown,01:14:33:27,01:14:38:27,In called a here for about a respirator in his hand. And we went in there and we.
Audrey Winter,01:14:38:27,01:14:39:28,Took this course.
Unknown,01:14:39:28,01:14:57:11,"On how to use it in case of an emergency and where it's located over. The teacher. And there's the, you know, a cross in front of a Red cross to show that it's there. And what to do, you know, with a heart attack, I mean, different things, you know, if it was necessary that."
