speaker,start,end,text
Audrey Winter,00:25:15:25,00:25:50:27,"Knowing the cards that I needed to make really, that I wouldn't, I'd always thought, well, I was raised in Kellogg, and I lived there in the same house, like I spent all my life. Years. I always assumed that I would just stay in Kellogg forever. I had been going to California and making room and everything. When it really came down to the point of it, I realized that that I couldn't stay there, that I would just be molded into the type of person that everyone thought I was, that I would never change, that I would just go ahead and continue to be this a spoiled brat."
Audrey Winter,00:25:50:27,00:26:00:19,"Just know that if I really wanted to make a life for my family and myself, I would have to go."
Unknown Interviewer,00:26:00:21,00:26:05:18,"That's pretty. That's pretty difficult for a 17 year old that's well, you."
Audrey Winter,00:26:05:21,00:26:27:14,"Know, with all the family business, I mean, you know, was I knew I knew the difference when I was with Ridge and why he'd come up here to hunt and everything, and I could see the difference in my life, and I, I knew that we would have to struggle because we didn't. We didn't have anything really to speak up."
Audrey Winter,00:26:27:16,00:26:55:01,"But yet it didn't seem to matter because it wasn't really, you know. But I knew that if I stayed there that I would my just like my brother and sister always kind of tell me that you have to do this because mom expects you to, or you better do that because you know, and. Right. And then, of course, the the man that my mom was going out with at the time who wanted to marry her and just told me, said the sooner you leave home, the better off of me because your mother and I want to get married."
Audrey Winter,00:26:55:09,00:27:20:10,"And I said, well, that's what I said, you know, I mean, that really made me feel good, too, when my sister and brother screaming, hollering, me, you can't leave! And he's telling me to hurry up and go. Of course, my mother didn't notice him four years later, but I just I felt like now that they're always going to be trying to tell me what to do and which they would want, I still go home and still have a tendency to try to, you know, come."
Audrey Winter,00:27:20:13,00:27:25:00,"And there's a lot of times that I thought, oh, I made a big mistake. I might go back."
Unknown Interviewer,00:27:25:03,00:27:38:10,"Did you have any idea, really, expectations in your mind before you got married about what marriage would be like? Yeah. Would you do over any expectations fulfilled or changed or."
Audrey Winter,00:27:38:13,00:27:39:06,Very changed.
Unknown Interviewer,00:27:39:06,00:27:40:01,In the.
Audrey Winter,00:27:40:03,00:28:04:29,"You know. Right. I like I said, you know, you just thought everything was going to be perfect. You know, you were going house and your husband was going to come home loving you after a beautiful day. And we're going to, you know. Work like that. You come home and you're crabby and he's crabby and, you know, it's just it's different."
Audrey Winter,00:28:05:01,00:28:26:23,"And of course, with mom and dad, they never, ever. Oh, I think they had one discussion in front of me, and it was over the TV when we first got our our very first TV and it was just smiling. She said, well, if you don't make up your mind, put it on the cable. We're putting it back in the box and shipping it away."
Audrey Winter,00:28:26:23,00:28:37:16,"He said, no, we're not and that would be a burden. Oh, so, you know, I, I didn't realize that people just didn't get married and get along. Oh, you know, I thought it would just be."
Unknown Interviewer,00:28:37:19,00:28:38:27,That you loved each other so much.
Audrey Winter,00:28:38:27,00:28:59:10,"So much, you know? Right. This is why we loved each other so much. We were just bound and determined to everything that's going to be beautiful. I just knew that's it wasn't there was very, very nervous because the first praise and every minute it was first part. I don't."
Unknown Interviewer,00:28:59:10,00:28:59:22,Know how.
Audrey Winter,00:28:59:22,00:29:01:14,I really don't.
Unknown Interviewer,00:29:01:16,00:29:06:25,"When the or when you were first pregnant, had you claim your first child or. No."
Audrey Winter,00:29:07:02,00:29:29:19,"I was very, very dumb. I wasn't taught anything about, you know, contraceptives. I mean, I really didn't it never dawned on me. And all of a sudden it was, you know, two months after I was married, a month and a half. I was pregnant. Oh, the big surprise to me. I mean, you know what I mean? You know, it's to expand, but it wasn't this open."
Audrey Winter,00:29:29:19,00:29:32:01,These things are now talked about to teenagers.
Unknown Interviewer,00:29:32:03,00:29:33:24,Your mother didn't talk too much.
Audrey Winter,00:29:33:26,00:29:54:23,"No, because she was bound and determined that I wasn't going to get married. So she didn't want to discuss it. And, of course, my sister, she didn't want to discuss it with me because I was wrong thing. And I didn't know a lot of things. Oh, I knew they could break out, but you know me, it just wasn't even real to me, you know, because I."
Audrey Winter,00:29:54:25,00:29:59:08,"Anything, they'd really think about it, I guess."
Unknown Interviewer,00:29:59:11,00:30:12:10,"You know, before you got married, though, I, I guess most of us think about when we're going to get married, when we're young girls. Did you think about when you were going to have children and if you planned how many or."
Audrey Winter,00:30:12:13,00:30:33:03,"Well, my sister Dolly should never have three because she had three and they fall and always have four. So I thought, well, I got to have four. So they won't fight. You know, I wasn't very smart. I was listening to what she said, her and Rich. And before we were married he talked. He said he always wanted a girl and a boy for the girl born first and about two years later, the boy."
Audrey Winter,00:30:33:06,00:30:54:16,"And this was his big dream. He came from a family. There were seven altogether, and he only wanted to know. And I mean, I couldn't care. And I always assumed, you know, after a year or two, after we were married, we'd have our first baby. Well, it didn't work out that way, but probably if we had him in pattern where we did, we probably would have never stayed together."
Audrey Winter,00:30:54:19,00:31:09:26,"Oh, you know, I had a big lesson to learn and I was very selfish. I mean, you know, always having your own way. You always expect to have your own way. Always. So when you cry, when you don't hear."
Unknown Interviewer,00:31:10:00,00:31:11:25,So I'm sure.
Audrey Winter,00:31:11:28,00:31:14:21,Growing up there the first few years.
Unknown Interviewer,00:31:14:23,00:31:19:00,"So, so the babies sort of stabilized."
Audrey Winter,00:31:19:04,00:31:28:05,They she she held us together. And the Lord knows that you probably wouldn't have made it any other way.
Unknown,00:31:28:08,00:31:34:20,"Oh my goodness, I don't know. Just she just."
Unknown Interviewer,00:31:34:22,00:31:40:17,Oh that's okay.
Unknown Interviewer,00:31:40:19,00:31:45:11,It's crazy. Wow. That's really great. Couldn't have been better.
Audrey Winter,00:31:45:11,00:31:52:04,"Clara Burgess was good apart when you, were pregnant."
Unknown Interviewer,00:31:52:06,00:31:58:20,You have your first child. Did you have to be driven to a hospital nearby or what? Well.
Audrey Winter,00:31:58:22,00:32:04:09,We lived in Saint Mary's. There were just a couple blocks from her husband.
Unknown Interviewer,00:32:04:12,00:32:05:18,"And uncle, and we were."
Audrey Winter,00:32:05:18,00:32:28:22,"Down there for about six months or so, and they took me down. And, you know, we'd waited. Nancy was overdue in the waiting room. Just 12 days and and do it. And so when I woke up and told him I was in labor, I looked at me, are you sure? You know, I mean, that really, really made me feel good after all that time you're awake."
Audrey Winter,00:32:28:23,00:32:33:06,"And as it turned out, there in the morning, I should have."
Unknown Interviewer,00:32:33:08,00:32:35:03,You could have said.
Audrey Winter,00:32:35:06,00:32:41:08,"Oh, baby, you know, after 17 hours later, they decided."
Unknown Interviewer,00:32:41:13,00:32:41:28,Oh.
Audrey Winter,00:32:41:29,00:32:43:11,We were going to die.
Unknown Interviewer,00:32:43:14,00:32:52:13,That long. Oh. Yes.
Unknown Interviewer,00:32:52:15,00:32:58:18,"Well, yeah. Can I ask you about."
Unknown Interviewer,00:32:58:20,00:33:15:04,"Did your mother, when you had your first child? Sure. You were going to have a child that she gave you a lot of advice to come to help you or. No, my mother called me. I mean, my mom is. My mom is. Oh."
Audrey Winter,00:33:15:04,00:33:24:27,"My mother came over after and had a baby. Of course. Talk to me after her. I can't, but, I been so, like."
Unknown,00:33:24:29,00:33:32:27,"You know, the people around there set you pretty good. I mean, you know, I helped my sister and her."
Audrey Winter,00:33:32:29,00:33:39:13,"Children were like it, too. And I really, when I was going to go to work."
Unknown,00:33:40:15,00:33:45:17,"for the family, a lot first, like I said, my dad."
Audrey Winter,00:33:45:23,00:33:49:10,Private matter and continue to take care of.
Unknown Interviewer,00:33:49:10,00:33:50:23,Them and give you some advice on.
Audrey Winter,00:33:50:23,00:33:51:16,Their hair.
Unknown Interviewer,00:33:51:21,00:33:55:06,Raising. All right.
Audrey Winter,00:33:55:09,00:34:15:11,"And I think with Nancy, I listen to everyone too much. You know, they just they had been very nervous and upset. You know, the fact that I wasn't doing this rider up during the summer, I and my sister in law at the river now, she, I think just an hour late. So I watch her and which I hate doing later."
Audrey Winter,00:34:15:13,00:34:35:12,"Oh, you know, I figured that was the thing to do, you know, whatever's needed there, because she. That was her fourth term. Oh. How many children around here? she took the receiving blanket off Lucy at such and such. And I watch comfortable, And I."
Audrey Winter,00:34:35:15,00:34:44:28,"You know, so I really think in my mind, you got to out the kids and then watch me. Oh, I'm going to be making a mistake, you know? Oh, it gets really great medical."
Unknown Interviewer,00:34:45:00,00:34:46:11,Cause I get a lot of pressure.
Audrey Winter,00:34:46:11,00:35:02:00,"Yeah, because I, you know, I just assumed that I wasn't going to be a good mother, and I worry myself too much about it. And having done so much later, I've been doing it for more because I've decided that they have any business. I knew."
Unknown Interviewer,00:35:02:03,00:35:04:01,"I mean,"
Audrey Winter,00:35:04:04,00:35:09:14,"You've got to monitor yourself, you've got to make mistakes and then go on."
Unknown Interviewer,00:35:09:16,00:35:15:25,And did your husband help you much in those early days with your first child with.
Audrey Winter,00:35:15:25,00:35:35:03,"You drove me crazy, you know, I mean, he was very nervous, protective. Father, when I got home from the hospital, well, with Nancy, my mother in law and him took her home first because she was going to go home, and I had to stay in hospital. So they had her for a couple, three days at home. And so."
Audrey Winter,00:35:35:05,00:35:39:05,"And and then having a steering wheel, it's hard for."
Unknown,00:35:39:05,00:35:45:09,You do a lot of stuff. So he.
Audrey Winter,00:35:46:11,00:35:47:08,I'm probably a good thing.
Unknown Interviewer,00:35:47:14,00:36:00:24,"Yeah. Sounds like. Well, do you have any plans right now for the international school? Yeah. We still. But to go on perhaps to college or."
Audrey Winter,00:36:00:27,00:36:24:03,"I'd like to, but mainly I don't. I don't want to force you into being the kind of person that I'd like to be in, that I'd like her define what she really wants out of life. She really loves animals, and she's talk about doing. And this is what she wants. I work the rest of my life in a supermarket, and that's what."
Audrey Winter,00:36:24:05,00:36:52:25,"I do want for her to. To get away from Caulder. I think that everyone couple should get away. Parents, both sides. And just going to be going on each other to have. Just to. And once you learn that you have a chair and the two of you are one, not two, separate your separate. But yeah, your and your your family for three years in the, you know, to learn to stand for 20."
Audrey Winter,00:36:52:28,00:37:16:27,"And with family interfering a lot, it's hard for you to learn to stand up against your parents and say, all right, you may not approve of this, but this is my life and you have no business telling her what to do. Or this is my husband and this is his home. And these kids get to do this. This is his business is right."
Audrey Winter,00:37:17:00,00:37:33:15,"And like raising your children, you may not always agree with what they do. But like I told him, I don't disagree in front of my kids. I won't even talk to you later. I mean, you know the thing, if you jump right in, in front of the kids right there, you erroneous."
Unknown Interviewer,00:37:33:15,00:37:45:26,"So it's good. Yeah, I agree with it."
Unknown Interviewer,00:37:45:28,00:38:05:14,"This is a strange question. I'm not sure if, since. How has the role of children changed since you had children with you? What you're asking, they're really. Children? I know in some form to raise the children with the helpers. Right. So?"
Audrey Winter,00:38:05:17,00:38:33:24,"So for. The lot now, our children probably in the rural area compared to like the cities or something, they still are so many couples, they are both me working. Nancy has her job, but she has to be. And if she didn't help to, I wouldn't be able to. I'm not having the time off. And so it's, which helps."
Audrey Winter,00:38:33:24,00:38:34:22,And I do things.
Unknown Interviewer,00:38:34:22,00:38:36:21,And we all just have to work together.
Audrey Winter,00:38:36:21,00:38:44:02,We remove careers just because there just isn't enough time on Saturdays and Sundays to get everything done. It needs to be done. You know?
Unknown Interviewer,00:38:44:09,00:38:49:06,"I know. Well, when you do have time."
Unknown,00:38:49:06,00:38:59:01,"To relax, what do you do for that social? Oh, I don't know. A lot of times I just studying everything and, you know, just,"
Audrey Winter,00:38:59:03,00:39:01:00,Get a chance to.
Unknown,00:39:01:02,00:39:07:21,"Really get involved. You know, I was working a lot of times I didn't get to study nurse much."
Audrey Winter,00:39:07:23,00:39:15:12,And if I'm out that and I have study groups and different times and maybe just going out and having fellowship with.
Unknown Interviewer,00:39:15:12,00:39:21:20,"Other people, do you as a family go out and do everything like go over and get ice cream or."
Audrey Winter,00:39:21:22,00:39:41:21,"You know. Yeah, we had a oh, that's pretty crazy. I mean, a lot of guilt. I mean, but Nancy was with us when I got my first year. My, my my very own, and, we come across bridge and I got Wednesday night and we came across the field and I was dragging my he was grabbing hers, and she was packing."
Audrey Winter,00:39:42:23,00:39:48:07,"I mean, this is just. And,"
Audrey Winter,00:39:48:10,00:40:18:21,"Sleigh riding in the wintertime or, once in a while, we're gonna go fishing. But most everything we do, we do. I very seldom, you know, what is an individual like? What's that mean? Not too often I do that because, well, he he likes me at home, and he likes my attention. All of my attention. Sometimes too much."
Audrey Winter,00:40:18:23,00:40:19:20,I'd like to be more.
Unknown,00:40:19:20,00:40:26:29,Of an individual.
Unknown Interviewer,00:40:27:01,00:40:37:19,"And, yeah, I don't like John. perfect. I'm not gonna go."
Unknown Interviewer,00:40:37:22,00:40:55:24,"On somebody else different. Oh, I think she's wondering what's going on. do you have any particular, I know you read the Bible, but any particular books and magazines? But whatever. We have it like farmer farming areas, type specific."
Unknown,00:40:55:24,00:41:03:19,"Magazines in general. And then, you know, I."
Audrey Winter,00:41:03:22,00:41:10:02,"I have some steady courses that I get in that are Christian training courses or something like that, but most of the time or."
Unknown,00:41:10:05,00:41:15:01,"Are just, are in Christian."
Audrey Winter,00:41:15:04,00:41:16:14,Right? Like my sister.
Unknown,00:41:16:18,00:41:23:16,And I were talking coming down from our meeting last night.
Audrey Winter,00:41:23:18,00:41:25:28,You are what you to.
Unknown,00:41:26:00,00:41:31:09,"And if you constantly put something funny, you know, a lot of people are."
Audrey Winter,00:41:31:11,00:41:52:02,"There for their other half lives. Can put her in the library with them. Words that are too nice. And she's, So she liked it. And I said, well, that's why I felt it. You should down, you know, having your home. What you want your children to learn and read. And so basically, that's what I have."
Unknown,00:41:52:02,00:41:57:25,I have Christian books around and that's real fun.
Audrey Winter,00:41:57:28,00:42:03:21,And I know you can get involved in a lot of the other stuff. You're going to have them involved too.
Unknown Interviewer,00:42:03:24,00:42:12:04,But so very sounded pretty important. There.
Unknown Interviewer,00:42:16:26,00:42:22:22,"Oh, this is a loaded question. have you ever thought what you might do if something happened to."
Unknown,00:42:22:22,00:42:29:17,"Your husband, if he was very ill or if he died accidentally?"
Audrey Winter,00:42:29:19,00:42:42:27,"Well, yes, I did. There was a little alarm here, and her husband was out hunting and fell in one of these pictures and a statement like, through, you know, and all of a sudden."
Unknown,00:42:42:29,00:42:54:02,"All of us around and we just look up to him. But what if that was me, you know, what would I do? And I thought about it and."
Audrey Winter,00:42:54:05,00:42:58:04,"I just don't remember, I, I would have to."
Unknown,00:42:58:04,00:43:02:07,Consider her and.
Unknown,00:43:02:09,00:43:04:14,Things go.
Audrey Winter,00:43:04:16,00:43:07:21,What I like to read someday able to do.
Unknown,00:43:07:23,00:43:13:15,Would be a lot to find and be with people. And like.
Audrey Winter,00:43:13:17,00:43:15:19,Be Christian.
Unknown Interviewer,00:43:15:22,00:43:20:09,"And of course, I mean, this is just a thing for nice for."
Audrey Winter,00:43:20:09,00:43:44:22,"Hearing about maybe two and maybe that should I have to go on two or I have to definitely go back to school. So and get an education up to go right now where I work now, it's probably one of the higher paying jobs. That's why I work here, because it's good money. Not. That's why I like it, because it's very hard."
Audrey Winter,00:43:44:24,00:43:50:07,But I would I would probably stay there until I get things going.
Unknown Interviewer,00:43:50:10,00:43:55:17,But do you think you're probably to.
Audrey Winter,00:43:55:19,00:44:02:11,Not write your first year of college before.
Unknown,00:44:05:01,00:44:10:15,"I think I probably would. I wouldn't go back for, but,"
Audrey Winter,00:44:10:18,00:44:11:15,There's a lot of kids.
Unknown,00:44:11:15,00:44:18:16,"Family and I love and everything, I don't think. I think."
Audrey Winter,00:44:18:19,00:44:38:22,"You know, I might write for a few years, but I think if Nancy got older, I would probably want to be in a place where she would, even if it was, you know, just Saint Mary's. I wouldn't really want to be there. But I'd like to be in a place where she could be have a chance if she wanted to be involved in groups with band and glorious record ever."
Audrey Winter,00:44:38:23,00:44:42:13,"In out here. We live 25 miles. I mean, if you're having."
Unknown Interviewer,00:44:42:13,00:44:45:20,"Practice after school, you're just kind of. Yeah, I."
Audrey Winter,00:44:45:22,00:45:06:26,"And but if I continue to live here, I would drive back and forth to make sure that she her chance to be involved in more joining sports or photographing, you know, this is a good thing. Part of things that the kids in this town in here is a social activity and, and I want I would like her to be of course, like I always wanted to be."
Unknown Interviewer,00:45:06:29,00:45:08:05,Like.
Audrey Winter,00:45:08:07,00:45:16:23,"I'd like her to have the chance. And if she didn't like it, I don't know for sure. But I'd like to know that she had a chance to go. And being that, you know."
Unknown Interviewer,00:45:16:26,00:45:29:13,"If she were 17, going on 18, and was getting married, what advice would you give her? Or would you run into your family? And I wouldn't."
Audrey Winter,00:45:29:15,00:45:45:00,"I would try to explain to her the things in my life and maybe the mistakes that I made. And of course, tell her that if I had the same thing to do or."
Audrey Winter,00:45:45:02,00:45:55:18,"I would just really ask her first. Take a long stretch to say, well, yeah, you got to really."
Unknown,00:45:55:20,00:45:59:07,Really try to get your perspective and.
Audrey Winter,00:45:59:12,00:46:12:10,Think about yourself like five years from the time that she's getting married or ten years and think of her and interests who?
Audrey Winter,00:46:12:12,00:46:35:27,"Everybody. I think when you're little, they're always go all the girls, you know, all along I get married, you know, and on and on and on. I have kids and. It's not, you know, it doesn't have to be that way. You don't have to immediately get married, and you don't have to, you know, I would just encourage her to."
Unknown,00:46:36:00,00:46:40:22,To maybe get to know a person better.
Audrey Winter,00:46:40:24,00:46:57:05,"And to tell her to have more things in common. You know, I mean, this would be a good thing. Like with me, I've never had a bad day in life, and I'd never caught a fish. I mean, you know, and of course, all the things that I like to do, he wasn't interested."
Unknown Interviewer,00:46:57:07,00:47:02:16,I don't know how we ever got together. I know it's strange.
Audrey Winter,00:47:02:18,00:47:19:27,"I mean, you know, divorced him, that I went to a football game and scream my head off and was so excited. It was crazy. But, you know, just just interest and excuse. Been on it. I guess the one thing I could do is just pray about."
Unknown Interviewer,00:47:20:00,00:47:25:29,"Would you talk to her about contraception? Oh, yeah. Definitely."
Audrey Winter,00:47:26:01,00:47:36:01,"I was one of the very First Nation. Yeah, I really sex education should be taught in a basic I mean, all the time, I mean, I she won't grow."
Unknown Interviewer,00:47:36:01,00:47:37:21,"Up, so she always tries to."
Audrey Winter,00:47:37:21,00:47:42:27,"Yes. Like like I was, I was very, very surprised."
Unknown,00:47:42:29,00:47:50:12,"I mean, I as a Christian parents I think that you should put your children the right and that it's not it's."
Audrey Winter,00:47:50:12,00:47:55:16,Not up to the schools or any place else. It's it's in her.
Audrey Winter,00:47:55:18,00:48:15:25,"And just be aware, you know, you don't have to be like the favorite saying around this area. A lot of times people mouth off means they will keep her pregnant in the summertime and barefoot near wintertime. That's the way to keep your life. well, young, I'm a firm believer."
Unknown Interviewer,00:48:15:25,00:48:19:13,You don't go.
Audrey Winter,00:48:20:29,00:48:23:28,So I maybe just.
Unknown Interviewer,00:48:24:00,00:48:25:05,Let her litter.
Audrey Winter,00:48:25:07,00:48:31:05,"Yeah. Be aware of a few things. And like, in a more prepared opinion."
Unknown Interviewer,00:48:31:07,00:48:36:29,That sounds good.
Unknown Interviewer,00:48:37:02,00:48:50:07,"Oh, here's some good ones. I know you talked about your church activities in the community here. Is there anything that you're really involved in?"
Audrey Winter,00:48:50:25,00:49:19:08,"yeah. The school, naturally. We have a parent teachers club rather than a PTA. This is putting you in when I can. Either I'm involved. They have, like I told you, they have carnivals, and, we go around for prizes. Yeah, I really am out here. That's about the only thing there is to be involved in."
Audrey Winter,00:49:19:10,00:49:37:04,"Is your school. Of course, if you wanted to drive. Or you can even drive to Saint Mary's because the bowling. Oh, no, I mean, no, they're they're just different. I mean, if you want to drive to Spokane and back, but I mean, you know, that's not a thing. So you just, you know."
Unknown Interviewer,00:49:37:07,00:49:53:27,"It's certainly is. what suggestions would you give to a young woman if you had a friend who said, well, I'm going to go and I'm going to live out in the country, what would you what would you want to prepare for if she wasn't used to that?"
Unknown,00:49:54:00,00:49:59:11,What would you want to tell her? It's what?
Audrey Winter,00:49:59:13,00:50:25:04,"And then just because it looks, you know, a lot of people today, they want to get back to the basics. Well, this is fantastic. I mean, you know, I think that before they sell everything they own and take off and go, they better go quiet first a little bit, you know, because there's there's not a lot of people like my other sister law that lives down here."
Audrey Winter,00:50:25:07,00:50:50:02,"She was in Spokane all their life. And she came up to this type of like and different. She will not I mean, she couldn't use every ring works her and she would not build a fire. You know, you have to to learn to do this and you have to be willing to make a sacrifice. You have to say, all right, it doesn't matter how I feel, right?"
