speaker,start,end,text
Unknown Interviewer,00;30;26;08,00;30;36;16,"And, you know, I felt like he could walk on the street from here. I, I haven't not the town. Oh, no. Now I hear down on Sunnyside."
Bonnie Nellsch,00;30;36;16,00;31;00;26,"He put her like that road in our town, but good. main part of town up there. When you, there's the intersection up there, and then you head down toward the YMCA. That that area is getting real rough anymore, and I wouldn't walk through there. There's a lot of hippies in, and, Well, I don't know, we call them hippies, but they're long hair and dopers and, I think bad area to walk around."
Bonnie Nellsch,00;31;00;26,00;31;03;15,I wouldn't walk through there at night by myself.
Unknown Interviewer,00;31;03;18,00;31;30;00,"Why did you have a beer? You could walk around for? Well, for instance, my mother and I would come home one the. And, there was a group of boys or girls from eight into that 25 years old stripper in a car, and she didn't dare stop and say anything because she's glad to have had her car stripped right down to."
Unknown Interviewer,00;31;30;02,00;31;55;20,"Is that graffiti that there was, you know, going around stripping cars that they could get off what they could used. And, The people are so different. They're just people are a small town, are a lot friendlier. You're neighbors in a big town. You're right. Your next door neighbor, you don't speak to your. You speak directly to your or ignore you or."
Bonnie Nellsch,00;31;55;22,00;32;02;15,"Oh, I think they go in that car and so on. Somebody was on the phone and call because would have been right there, you know. Oh yeah."
Unknown Interviewer,00;32;02;15,00;32;28;15,"Where I so it sounds like nobody wanted to interfere. We want to get involved. Nobody wanted to get involved. You just don't. Do you have the police around here? I think so, I think sometimes we do. I think sometimes we don't. I had a prowler up one day. One night, scared there. And I heard something outside. It was him, and late at night."
Unknown Interviewer,00;32;28;18,00;32;49;28,"And I opened up my curtains and he was scaring them. And I was just him. And it scared me to death. I would think that something was out there. And my husband says, oh, you're always hearing stuff. And I said, oh, no. And I described what the guy was like. And so he put on his clothes and ran outside, and it had been raining where you see where the guy had been."
Unknown Interviewer,00;32;49;29,00;33;13;27,"He kept working with them. When it's cold. And I called the police and they were right down here, right down here. But then, something else happened and they never showed up at all. And so I oftentimes I spoke right around the house or something. I don't know, sometimes they're right there in front of them. I don't know."
Unknown Interviewer,00;33;13;27,00;33;22;26,I think I got them because they're in somebody's.
Unknown Interviewer,00;33;22;28,00;33;29;18,"Home. I'm not sure that would be perfect for I don't care. So, yeah, I had."
Bonnie Nellsch,00;33;29;18,00;33;44;02,"A problem, too. It wasn't. It wasn't right at my house. I happened to be putting my kids to bed, and I was upstairs, and I had to look out, and this guy walked in front of the house, and then he walked into the back of the house. The only thing in the back of my house is the neighbors little house."
Bonnie Nellsch,00;33;44;03,00;34;03;09,"They went out only wasn't being rented out at the time. So I watched this character and I went to the other side of the house and looked out my bedroom window, and he was. He, let himself walk into the back of the house back there. And so I went ahead and call the police, but they were right out there, and they got him, cornered him underneath the bed in that house."
Bonnie Nellsch,00;34;03;12,00;34;04;26,Your car.
Unknown Interviewer,00;34;04;29,00;34;25;26,"I know I never I felt safer living in Tennessee when I was in town three times over here for. You heard it. You and everybody, of course, was scared for your and for maybe a stuff like that. What has been going on when I was down here on the road for guilty and you know, if you to go, go back."
Unknown Interviewer,00;34;25;27,00;34;28;04,You're for Boston.
Bonnie Nellsch,00;34;28;04,00;34;32;12,"Strangler. You go, no."
Unknown Interviewer,00;34;32;14,00;35;02;06,"Know. Oh for man, that was a big thing when I was down there at that one radio station and he called to that one guy who was, a criminal lawyer, I believe, or was the only guy to go to that killer because he would be careful not a farmer. And down there he would say things like, oh, he didn't like to kill people like you get real bad headaches and I was with young people."
Unknown Interviewer,00;35;02;09,00;35;12;22,"He said. Next bits of work that all the little kids bouncing off the school back, you know, when I saw you."
Bonnie Nellsch,00;35;12;22,00;35;14;09,Refreshing a little pocket here.
Unknown Interviewer,00;35;14;12,00;35;45;10,"Where did they catch him? No, we all just quit. Clear. we haven't heard anything more, you know, like the Boston Strangler. Yeah. Yeah. Oh, I don't have anything good to catch. Yeah. how is your family life now? And compared with what it was when your father. Oh."
Bonnie Nellsch,00;35;45;13,00;35;50;08,I'd say calmer. What time? I know.
Bonnie Nellsch,00;35;53;02,00;35;59;13,My dad had quite a temper. That's why I said calmer.
Bonnie Nellsch,00;35;59;15,00;36;00;23,That's the only reason I think.
Unknown Interviewer,00;36;00;23,00;36;28;16,"Calm, I heard, can't compare it because when I was growing up, the cost of living or the value of money. I mean, we felt it, but not right to feel it. When you're in your own home, with your own family and worrying about your own health, I don't. I know I can't compare it. When you were young at home, I was still in school."
Unknown Interviewer,00;36;28;19,00;36;55;23,"And finally we were. In fact, we're passing a test for who I was going to be going out with her right now. That's not at all your thoughts. Your thoughts were more about, you get your calls for school, for your parents and. Your thoughts are so different. I, I can't really compare it to. What do you do for recreation in your career?"
Unknown Interviewer,00;36;55;26,00;37;00;06,When I was growing up.
Unknown Interviewer,00;37;00;09,00;37;02;19,I can't read a lot on.
Bonnie Nellsch,00;37;02;24,00;37;04;18,"All right, you didn't I your."
Unknown Interviewer,00;37;04;18,00;37;38;07,"I was an interactive environment. I would have an awful. I I'm not a boyfriend. That was my her preferred I don't know I couldn't have not been what she wrote letters. Although I wrote that girl so much. Yeah. I wrote, you know and I was 16. I just turned 16 after. Remote control two about three years every month."
Unknown Interviewer,00;37;38;07,00;37;44;28,"Right. For prom. And they didn't go out. I don't know, that was your main concern."
Vicki Mitchell,00;37;44;29,00;37;51;07,Maybe I can right now.
Unknown Interviewer,00;37;51;09,00;38;06;23,I'm relying more on the cost of you for anything. Yeah. More? Yeah. I still like to go camping. Do I go camping now or go with my mom? we haven't been camping for 15.
Bonnie Nellsch,00;38;06;23,00;38;11;07,"Very, working. Working on a weekend group. That's working?"
Unknown Interviewer,00;38;11;07,00;38;37;20,"Yeah, I. You find a director? I have my sister here, but my six year old, I have my family near me are great. Oh, and I always wanted to bring out your camping. I was really surprised when I could see her gone from her. You know that that group."
Bonnie Nellsch,00;38;37;22,00;38;45;29,"We used to go camping a lot, though. I know where she work with stick in the mud. But we did go camping for, camping."
Unknown Interviewer,00;38;46;01,00;38;47;17,Fishing.
Bonnie Nellsch,00;38;47;19,00;38;55;25,"Swimming. Went swimming an awful lot at Roseland all the time, but I really can't see what."
Unknown Interviewer,00;38;55;27,00;38;58;17,I'm not great. But going out to the river.
Bonnie Nellsch,00;38;58;20,00;38;59;24,I'm.
Unknown Interviewer,00;38;59;27,00;39;22;19,"I, I'm also not so. Well, I did. I broke my leg, I did, and I broke my leg. And now I'm going to quit conditions, or I can start the season. I never really, get any kids in school every morning. And, get into my bowling every morning or evening. I was at, last."
Bonnie Nellsch,00;39;22;21,00;39;28;12,"The basketball class, ball field, going seven times a week."
Unknown Interviewer,00;39;28;15,00;39;49;01,"I have a good way for nights, to go out of camp all. And I love it, I love it, yeah. I have a ball. You want me to go with you? Could go with the babysitter to my sister. My sister? Michael. Yeah. I go out."
Vicki Mitchell,00;39;49;03,00;39;53;27,"And have a ball. I mean, I like time."
Unknown Interviewer,00;39;54;00,00;39;56;24,We're probably.
Vicki Mitchell,00;39;58;11,00;40;01;01,"go. Well, we're going bowling."
Unknown Interviewer,00;40;01;01,00;40;35;04,"And y'all, we're right after we're done. John, who's your best friend? Parker. Yeah, well, not me, but this year, I can't get the manager approved. they're not going to get. My husband works different here. So you get, you get to try to get through nine weeks. Three and my husband out to get our firm right, which we would like to do about three."
Unknown Interviewer,00;40;35;06,00;40;43;11,"I guess that makes it really different. our two aren't working. I'm three and three, so. Yeah. Right."
Bonnie Nellsch,00;40;44;28,00;41;07;27,"right. That's another reason I quit working. Two was because of the difference. Yes. You don't seem to. And, if I were to stay up at Westchester Hospital working up there, I would hit the difference. Yes, two. That would have been a lot of hassle. Both on three levels the same time. I wouldn't have been bad, you know, but, like, if he had been on base and I been on three mountain."
Unknown Interviewer,00;41;08;00,00;41;13;15,"I don't know. Yeah, I knew a couple of things that I thought of where we were going to work when she was coming home."
Bonnie Nellsch,00;41;13;16,00;41;15;08,Right. You never see each other.
Unknown Interviewer,00;41;15;10,00;41;16;07,One was like.
Bonnie Nellsch,00;41;16;10,00;41;23;03,"God, I didn't have a fight in the middle of all that. Nothing would settle her."
Unknown Interviewer,00;41;23;06,00;41;31;15,"At the time. But yeah, that's what I'm not making out right. Oh, most important, would you like to go hiking?"
Bonnie Nellsch,00;41;31;17,00;41;46;00,"Oh, yeah. I'm back. I'm going to go hunting this year. then, road hunting. But I haven't really got out there in the woods much, but I'm going to this year. Are you apprehensive about the number of people out here? What's that?"
Unknown Interviewer,00;41;46;03,00;41;49;01,Are you apprehensive about the number of people out here?
Bonnie Nellsch,00;41;49;03,00;42;04;21,"Yeah, I'm really, kind of scared of the amount of people out and, the amount of accidents that go on. There are an awful lot of accidents for such a small area. Well, I guess it's maybe not that small, but."
Unknown Interviewer,00;42;04;21,00;42;07;05,"Yeah, well, we got a lot of people out. Yeah."
Bonnie Nellsch,00;42;07;08,00;42;19;29,There are an awful lot of out-of-staters California hunters come up all the time. Oregon. And I've known bad because there's enough hunters just from the local area alone.
Unknown Interviewer,00;42;20;01,00;42;30;00,I don't know if you realize you the say that most of the Idaho is one me and it would be outfitter scatter my surfing out.
Bonnie Nellsch,00;42;30;03,00;42;48;09,"Oh yeah. I don't doubt that I. I didn't read it, but it doesn't surprise me because I know the people around here are definitely out for the me because they need it. Well, well, I mean, we get the meat, we will eat it and we're not, you know, we're not picky at all because we we enjoy the elk in the beer on the barometer."
Unknown Interviewer,00;42;48;11,00;42;55;14,"And that's great. Hunter, what are we going to do if we got 1 or 2 deer or. I'll put everything and ship it down to California."
Bonnie Nellsch,00;42;55;16,00;43;12;16,"You know, they're going to probably let it go to waste. That's what makes me. not necessarily. Might not let it go to waste, but how we going to get it? Whether, you know, going freezer in their camper, you know, they don't have a freezer, right."
Unknown Interviewer,00;43;13;14,00;43;20;00,"have you ever gotten, you know, try hard, but don't you."
Bonnie Nellsch,00;43;20;03,00;43;21;07,Got a fish today?
Unknown Interviewer,00;43;21;07,00;43;25;02,But my husband let it go too far. No.
Bonnie Nellsch,00;43;25;05,00;43;45;17,"So the first fish I've caught all year, I fell in the water and everything else today up there. Correct. And I got this fish. And he is going to put in this water to bag with the, plastic inside. I think I'll hit the bag. So I left it down there and he went to go get it. So he puts it on a stick, and then he puts it in the water and puts his itty bitty."
Unknown Interviewer,00;43;45;17,00;43;47;27,"Rock about like, so on."
Bonnie Nellsch,00;43;48;00,00;43;49;09,"Next thing you know, returns over."
Unknown Interviewer,00;43;49;09,00;43;51;07,There and the fish is gone.
Bonnie Nellsch,00;43;51;09,00;43;53;10,By one fish. I talked to.
Unknown Interviewer,00;43;53;12,00;43;58;06,"Her. Oh, God. was it trout?"
Bonnie Nellsch,00;43;58;08,00;44;16;07,"Oh, yeah. Wow. All right. River native. It was a good look from. Oh, we've gone grouse. Grouse hunting too. And I've shot and miss shot. Miss. Not that I don't try."
Unknown Interviewer,00;44;17;00,00;44;21;05,So you miss your husband? Have you been getting paid? No.
Bonnie Nellsch,00;44;21;08,00;44;32;11,"I heard in the grouse that I shoot. Miss that. He gets them. We just haven't seen any, elk or deer at all."
Unknown Interviewer,00;44;32;13,00;44;35;08,In this area around here?
Bonnie Nellsch,00;44;35;10,00;44;49;07,"Yeah. pretty much all around here. warmer and more like that. Warm. Yeah, yeah. Down there. it's gone down there a couple times, but mostly it's around here."
Unknown Interviewer,00;44;49;27,00;45;03;23,"yeah, I know I we've been right here. You you went through an outdoorsman. I just didn't haven't heard one. Oh, I, yeah, we we like to go out and play golf an awful lot."
Bonnie Nellsch,00;45;03;25,00;45;05;29,Right back there hunting for.
Vicki Mitchell,00;45;06;01,00;45;11;26,"Easter, right? Oh, yeah, I love it. I don't mind it. I think it's good fun, though."
Unknown Interviewer,00;45;11;28,00;45;22;04,"Well, you don't get me wrong, I know, right? I'm right. Fish, I go fishing. Oh, I, I, I'm not at all interested in going hunting. All right."
Bonnie Nellsch,00;45;22;11,00;45;24;17,bar graph is 3330.
Unknown Interviewer,00;45;24;21,00;45;25;27,Go out target there.
Bonnie Nellsch,00;45;26;15,00;45;27;25,"No, I can do that."
Unknown Interviewer,00;45;27;28,00;45;40;06,"But two and that's road hunting for us is boring. Get out. We were hiking that. Yeah, definitely. Bring the deer back. Campervan, right? Yeah."
Bonnie Nellsch,00;45;40;13,00;46;06;03,"For at least if we got one. Be so thrilling. You know, you finally got we have had game that was his uncle got it. But we all season we all went out there and it was a big family affair. We had to two elk and we all went out in the garage after that. You know, I teared up for about 3 or 4 days and we all went out and bought to do that, cut it and wrapped."
Bonnie Nellsch,00;46;06;05,00;46;09;14,That was kind of fun doing that.
Unknown Interviewer,00;46;09;17,00;46;14;16,I never want to think I have more space or something like that. I was that right?
Bonnie Nellsch,00;46;14;19,00;46;22;14,"Really. we had a lot of it because like I said, those two out and we had roast after row, state after state, it was."
Bonnie Nellsch,00;46;23;12,00;46;27;10,"You have to know how to cook it. So if you don't like that wild piece, you have to know how to cook it."
Unknown Interviewer,00;46;27;10,00;46;27;23,Right?
Bonnie Nellsch,00;46;28;01,00;46;28;24,I'm a.
Unknown Interviewer,00;46;28;27,00;46;36;18,"Manager. I get, you're meat and lousy, and I get your meat, and it's not being good."
Bonnie Nellsch,00;46;36;20,00;46;40;14,It's all in. Who's cooking? I think so. And who's prepared it before?
Unknown Interviewer,00;46;40;16,00;46;51;25,"Yeah, I have been there for the what? We had first year. The second year that you got to that there aren't too many of that. I know. Well you know."
Bonnie Nellsch,00;46;51;27,00;46;52;15,Where.
Unknown Interviewer,00;46;52;17,00;46;56;26,You are. Is that where you from? Georgia. My husband.
Bonnie Nellsch,00;46;56;28,00;46;58;24,Oh he is.
Unknown Interviewer,00;46;58;27,00;47;09;03,Yeah. Where are some of the other things that you do for recreation? In some bike ride. Ride bikes? Yeah.
Bonnie Nellsch,00;47;09;05,00;47;20;00,Rack. We rack down the river. We just started that this year though. I remember racks. Yeah. We six man rap. We both have six craft. Go down the river.
Unknown Interviewer,00;47;20;00,00;47;23;22,With quick river. The North fork up here.
Bonnie Nellsch,00;47;23;24,00;47;35;00,It's so low now you can't much. You still can't carry your rap. Not a lot. So it's not worth it.
Vicki Mitchell,00;47;35;03,00;47;38;12,I love your have to come.
Unknown Interviewer,00;47;38;15,00;47;44;10,My mom? Yeah. Your mom quit here.
Vicki Mitchell,00;47;44;13,00;47;49;23,Are you all right? I wonder what I'm.
Unknown Interviewer,00;47;49;23,00;47;55;04,Going to keep going. Keep?
Vicki Mitchell,00;47;55;07,00;48;00;20,Quiet for a while. why.
Unknown Interviewer,00;48;00;20,00;48;04;27,"Don't you back before you got married? Love, love."
Bonnie Nellsch,00;48;04;27,00;48;09;03,"Love, love. That curve for that."
Unknown Interviewer,00;48;10;10,00;48;18;29,have time. where you go back to the are revive. That'd be your question.
Vicki Mitchell,00;48;20;20,00;48;28;13,I have a hard question.
Vicki Mitchell,00;48;28;15,00;48;30;25,On. I don't know how to answer it.
Unknown Interviewer,00;48;34;03,00;49;04;12,"I was really disillusioned with my first part where, I because I, I always wanted man to take care of me. I never I like women where I live to a certain point, but I want to very on. Yeah. You know what? That's what your works for me going on my first time home like that. And I expect that I was very worth my ass."
Unknown Interviewer,00;49;04;12,00;49;29;10,"And now I'll go anywhere that comes out. I can lean on and let them worry about it. You know? And, I, I like having the man be the boss and down when that comes down to something, I think, I like to have a backbone about it now. I do what I want it, and I can do it."
Unknown Interviewer,00;49;29;10,00;49;33;07,"My first marriage or just marriage, I got."
Vicki Mitchell,00;49;33;09,00;49;41;18,I got good. So I am.
Unknown Interviewer,00;49;41;20,00;50;15;15,"I'm happy for her. We're gonna be friends. And I felt like I was married trying to raise. And now I've gotten married. I feel like I'm a married woman with a young man, and I get like, before I get to have a three year number one. And for her, I want to marry and children are first. I wanted one child and one and one child."
Unknown Interviewer,00;50;15;17,00;50;41;07,"She was off for a long time. And then I definitely want to go more like, why not all the kids? I have a clue or a girlfriend. I like to get up and go and I want that word settle down. Like, I gotta figure out how. To. It's just right for me to handle."
Bonnie Nellsch,00;50;41;09,00;50;43;22,One of you can right?
Unknown Interviewer,00;50;43;24,00;50;58;29,"I'm ready for that. Put children. Yeah. And number children. I feel the same way. Too funny. Three's a crowd. You know, like I do, too. It's really just about the right number."
Bonnie Nellsch,00;50;59;02,00;51;15;27,"Right? You can show an equal amount of love and affection for it, I mean, attention, not that you wouldn't love another word if you have it, but, two's planning. I can handle that. Fine. And also on, minors income, they don't make that much money, you know."
Vicki Mitchell,00;51;15;29,00;51;21;03,"Right? Right. Well, right. Right, right, right."
Unknown Interviewer,00;51;21;05,00;51;24;21,If for Ukraine to get longer and all of this.
Bonnie Nellsch,00;51;25;02,00;51;29;03,"so to get along better because, we have four in our family and we get along fine, you."
Unknown Interviewer,00;51;29;04,00;51;32;03,"Know, and I get along better with."
Bonnie Nellsch,00;51;32;03,00;51;35;21,"Two. Oh, yes. To the mother mother's benefit for two."
Unknown Interviewer,00;51;35;21,00;51;45;06,"That's all I wanted to have my family, where I would be young enough after they've gotten older. I still would have enough that I could,"
Bonnie Nellsch,00;51;45;08,00;51;45;27,Do what you want.
Unknown Interviewer,00;51;45;29,00;51;50;26,"Do what I wanted. But yet my family, I was different."
Bonnie Nellsch,00;51;50;28,00;51;59;18,"So, you know, probably because we see our mother, you. And when we were young. When she was young. And so therefore, when we."
Unknown Interviewer,00;51;59;18,00;52;00;18,All.
Bonnie Nellsch,00;52;00;21,00;52;07;18,"Grew up and got married, she was still young enough to get out and do what they want to do. And I'm the old and."
Unknown Interviewer,00;52;07;25,00;52;16;17,"I, I, I feel old now to start having more good."
Unknown Interviewer,00;52;16;20,00;52;24;17,"Different music program just a few months older than you are. You are, you are. Yeah. I mean, it's like my cousin, she."
Bonnie Nellsch,00;52;24;17,00;52;25;03,Just had.
Unknown Interviewer,00;52;25;03,00;52;25;16,Her first.
Bonnie Nellsch,00;52;25;16,00;52;27;13,One and she's 29.
Unknown Interviewer,00;52;27;14,00;52;31;02,I think 28 or 29. So.
Bonnie Nellsch,00;52;31;04,00;52;53;03,"And then there's, another friend of mine in Houston, California, he's 34, and he asked me where when had ended, and he's still planning on it, but he's getting kind of up there for the concert. Well, guard our children are. But now maybe she feels differently. Maybe she feels like, he wants to get all the running around and entertainment out of her life."
Bonnie Nellsch,00;52;53;03,00;52;58;11,"Now, when she's young. And then we settle down. The kids later."
Vicki Mitchell,00;52;58;13,00;53;03;01,I don't want.
Unknown Interviewer,00;53;03;04,00;53;29;12,"Them or any normal group or. I'm not. I don't think I can handle through, if I could, if I had to. And I know if I had another one, I don't, I go, I worry about I heart from a couple years ago because we definitely I definitely don't want to be a certain way. so you went along with what I wanted."
Unknown Interviewer,00;53;29;15,00;53;54;22,"What? The doctor. You have any qualms about performing? Well through my doctor? Yeah, because my doctor is not gonna got, he's got. I wouldn't warm the like that for, like, three hours. back when you ask my doctor because you work at the school and you're looking for work and the average, they have no doubt about it."
Unknown Interviewer,00;53;54;22,00;54;06;10,"Not from north. Now, I'd say, if we were to go, like being homeless might be coming to sign saying that I agree."
Vicki Mitchell,00;54;06;13,00;54;11;01,To have that form of.
Unknown Interviewer,00;54;11;03,00;54;28;05,"It I really I was really worried about that. So I have control of your school what through your, about three years ago, I wanted my grandkids around, but I never felt that my."
Bonnie Nellsch,00;54;28;07,00;54;30;14,Little crap dragging.
Unknown Interviewer,00;54;30;14,00;54;49;06,"You know, and since have your. And no matter. Who I was, we were all for it. I was out for. I never did get to where you have your expectations of married man. Oh, I'm."
Unknown Interviewer,00;54;49;09,00;54;51;22,"I'd say so now. No, I."
Bonnie Nellsch,00;54;51;24,00;55;20;12,"I fear I don't have a good marriage. I mean, I've got ups and downs, good days and bad days, but I feel like it's pretty much what I expected. not. And depends on how. Well, when I was 16, I had a big dream about marriage and how wonderful it was going to be mean. When I got, to the night 20 and I realized what reality was all about, and it wasn't going to be what you thought."
Bonnie Nellsch,00;55;21;18,00;55;32;00,"I think everybody, when they're about 16, looks at marriage through rose colored glasses. And so, you know, you all think, oh, marriage that's going to solve all your problems. Yeah. Well."
Unknown Interviewer,00;55;32;02,00;55;40;16,"I think, whenever you think, oh, he's going to wait on me because he loves me so much this year. But, your."
Bonnie Nellsch,00;55;40;16,00;55;41;22,Family flowers.
Unknown Interviewer,00;55;41;27,00;55;57;04,"On special days and all that crap cream. I cook my dinner, get my. Oh, yes. Thank you. Flowers occasionally."
Bonnie Nellsch,00;55;57;06,00;56;04;26,"Oh. I see you in, when I was in the hospital, they sent me flowers when I had, the second child sent me flowers."
Unknown Interviewer,00;56;04;28,00;56;20;15,"Top here. Our first ever third anniversary. My husband that new roses that he. My second year, our second anniversary. I am carnations. My third anniversary with a box of candy."
Bonnie Nellsch,00;56;20;18,00;56;22;01,"Laced, etc.. Something."
Unknown Interviewer,00;56;22;03,00;56;59;19,"Hey, no more flowers. Oh, my. I or, it really doesn't bother me. I think I because I've seen, every marriage has been close to us. very good. Bad. And I'm so grateful for that grant that that I'm really grateful for our marriage. To see that my husband comes home at night. So if it weren't here in the bar that was home, I can't really, you know, necessarily."
Unknown Interviewer,00;56;59;21,00;57;05;22,"All right, all right. I have to come home at night. And he our."
Bonnie Nellsch,00;57;05;25,00;57;11;29,"Provider in a good way, come in. So many of the miners, our drinkers. Yeah, there are."
